{
  "schema_version": "1.0.0",
  "generated_by": "ai-company-run-email-boss-allowlist-test-gate-mission.mjs",
  "integration_target": "paperclip",
  "data_label": "DEMO_LOCAL_ONLY",
  "demo_warning": "⛔ LIVE TEST SEND NOT ENABLED IN PR. BOSS ALLOWLIST ONLY. NOT SENT. ONE EMAIL ONLY. NO REAL CUSTOMER CONTACT. NO GMAIL API CALL IN PR. NO SMTP CALL IN PR. NO PROVIDER API CALL IN PR. NO CRM UPDATE. NO PAYMENT REQUEST. RUNTIME LIVE TOKEN REQUIRED. RETRY DISABLED. DUPLICATE SEND PROTECTION REQUIRED. KILL SWITCH REQUIRED.",
  "test_overview": {
    "live_send_enabled_in_pr": false,
    "emergency_stop": true,
    "test_action_count": 1,
    "total_blocked": 1,
    "demo_badge": "🔵 DEMO / BOSS ALLOWLIST TEST GATE SIMULATION — NOT SENT — NOT A LIVE EMAIL SYSTEM",
    "safety_note": "This is a local Boss test gate. No email has been sent. No provider has been contacted."
  },
  "test_action": {
    "gate_id": "boss_test_gate_001",
    "milestone": "1.0V",
    "mode": "EMAIL_BOSS_ALLOWLIST_TEST_GATE_ONLY",
    "source_pilot_action_id": "pilot_email_action_001",
    "test_action_type": "send_email",
    "test_action_count": 1,
    "recipient_kind": "BOSS_ALLOWLIST_RUNTIME_ONLY",
    "recipient_is_customer": false,
    "recipient_email_in_repo": false,
    "recipient_email_placeholder": "boss-runtime-allowlist-placeholder@alex-minh-ai.demo",
    "recipient_runtime_required": true,
    "subject": "Hệ thống Bán hàng Web + Chatbot AI Tự động cho SME Thanh Hóa",
    "body_preview": "Chào Anh, Alex Minh AI đã sẵn sàng triển khai hệ thống Web + Chatbot AI với mức giá 12.9 triệu...",
    "offer": "Web + Chatbot AI",
    "price_anchor": "12.9 triệu VND",
    "cta": "Execute Boss live test send",
    "live_send_enabled_in_pr": false,
    "future_runtime_send_allowed": false,
    "send_blocked_in_pr": true,
    "block_reason": "Milestone 1.0V is local test gate only. Real send requires runtime command with OWNER_APPROVED_LIVE_TOKEN post-merge.",
    "provider_status_in_pr": "FAKE_LOCAL_ONLY",
    "provider_ready_in_pr": false,
    "runtime_provider_required": true,
    "actual_external_effect": "NONE",
    "owner_live_token_required": true,
    "required_live_token_name": "OWNER_APPROVED_LIVE_TOKEN",
    "required_live_token_scope": "pilot_email_action_001",
    "required_live_token_format": "OWNER_APPROVED_LIVE_TOKEN=pilot_email_action_001",
    "merge_token_not_accepted": true,
    "sandbox_token_not_accepted": true,
    "idempotency_key": "idemp_test_boss_001_v1",
    "duplicate_send_protection": true,
    "retry_policy": "DISABLED",
    "kill_switch_required": true,
    "kill_switch_active_in_pr": true,
    "audit_required": true,
    "runtime_audit_log_must_include": [
      "gate_id",
      "timestamp",
      "idempotency_key",
      "recipient_validation",
      "live_token_validation",
      "kill_switch_preflight",
      "delivery_status",
      "actual_external_effect"
    ],
    "safety_attestation": "ATTESTATION: LIVE TEST SEND NOT ENABLED IN PR | BOSS ALLOWLIST ONLY | NOT SENT | ONE EMAIL ONLY | NO REAL CUSTOMER CONTACT | NO GMAIL API CALL IN PR | NO SMTP CALL IN PR | NO PROVIDER API CALL IN PR | NO CRM UPDATE | NO PAYMENT REQUEST | RUNTIME LIVE TOKEN REQUIRED | RETRY DISABLED | DUPLICATE SEND PROTECTION REQUIRED | KILL SWITCH REQUIRED",
    "safety_warning_lines": [
      "⛔ LIVE TEST SEND NOT ENABLED IN PR",
      "⛔ BOSS ALLOWLIST ONLY",
      "⛔ NOT SENT",
      "⛔ ONE EMAIL ONLY",
      "⛔ NO REAL CUSTOMER CONTACT",
      "⛔ NO GMAIL API CALL IN PR",
      "⛔ NO SMTP CALL IN PR",
      "⛔ NO PROVIDER API CALL IN PR",
      "⛔ NO CRM UPDATE",
      "⛔ NO PAYMENT REQUEST",
      "⛔ RUNTIME LIVE TOKEN REQUIRED",
      "⛔ RETRY DISABLED",
      "⛔ DUPLICATE SEND PROTECTION REQUIRED",
      "⛔ KILL SWITCH REQUIRED"
    ]
  },
  "live_token_execution_policy": {
    "merge_token_name": "OWNER_APPROVED_MERGE_PR",
    "sandbox_token_name": "OWNER_APPROVED_EMAIL_SANDBOX_TOKEN",
    "future_live_token_name": "OWNER_APPROVED_LIVE_TOKEN",
    "merge_token_must_not_enable_live_test": true,
    "sandbox_token_must_not_enable_live_test": true,
    "future_live_token_reserved_only": true,
    "one_token_one_test_action": true,
    "token_scope": "PILOT_ACTION_ID",
    "token_expires_after_use": true,
    "token_must_match_action_id": true
  }
}